{
  "document_kind": "p3a_c2_projected_envelope",
  "contract_version": "1.0",
  "projection_status": "planning_projection",
  "compose_projection_strategy": "single_core_probe",
  "source_plan_digest": "sha256:aaaaaaaaaaaaaaaaaaaaaaaaaaaaaaaaaaaaaaaaaaaaaaaaaaaaaaaaaaaaaaaa",
  "derivation_policy": "manual_prediction_with_later_mechanical_validation",
  "unmodeled_dimensions": ["full_rule_assets"],
  "decision_population_summary": {"v041_primary": 150, "v042_protected": 20, "v043_protected": 1},
  "entries": [
    {
      "decision_id": "V040-C2A-001",
      "source_locator": "plan:c2a_core",
      "primary_version": "V0.4.1",
      "implementation_owner": "p3a_c",
      "requirement_kind": "system_projection",
      "projected_counts": {"rule_fragment": 1, "binding": 1, "key": 1, "candidate": 1},
      "scope_topology": "single_core_probe",
      "conflict_approval_assumption": "none",
      "derivation_formula": "one synthetic binding projects to one candidate key",
      "confidence": "medium",
      "zero_load_reason": "none",
      "blocked_projection": false
    },
    {
      "decision_id": "V040-C2A-002",
      "source_locator": "plan:v042_boundary",
      "primary_version": "V0.4.2",
      "implementation_owner": "future_primary",
      "requirement_kind": "protected_boundary",
      "projected_counts": {"rule_fragment": 0, "binding": 0, "key": 0, "candidate": 0},
      "scope_topology": "unmodeled",
      "conflict_approval_assumption": "unmodeled",
      "derivation_formula": "protected future boundary carries no base appearance load",
      "confidence": "high",
      "zero_load_reason": "protected_boundary",
      "blocked_projection": false
    }
  ]
}
